beeldid,LEGEND,trfwf_original,pays_quid,lieu_wikidata_qid,lieu_wikidata_name,BPALLASF,lien_phototheque,spatial - key - key,spatial - value - value,imageclassification - class1,imageclassification - prob1,imageclassification - class2,imageclassification - prob2,imageclassification - class3,imageclassification - prob3,imageclassification - class4,imageclassification - prob4,imageclassification - class5,imageclassification - prob5
00031717,"Ce samedi 3 avril a eu lieu à Bruxelles la remise solennelle d'un escadron mobile de l'école de police par le directeur de cette école, le commandeur Monsieur Van Voorst, au bourgmestre de Bruxelles, monsieur Grauls. -- -- Le Bourgmestre Grauls accompagné du directeur Van Voorst passant en revue l'escadron mobile. -- -- Op zaterdag 3 april had te Brussel het plechtg overgeven van een mobiel  escadron van de politieschool  door de bestuurder van de school aan burgemeester Grauls. -- -- Burgemeester Grauls vergezeld van Bestuurder Van Voorst, schouwt het escadron. [4/4/1943] [Frei gegeben durch zensur] [Sipho]",,,,,"Jan Grauls, gouverneur de la province d'Antwerpen (1940-1942) et bourgmestre du Grand-Bruxelles (1942-1944), 1943-1944. - 12 photos",http://pallas.cegesoma.be/pls/opac/opac.search?lan=F&seop=5&sele=52&sepa=1&doty=_CA&sest=&chna=&senu=31717&rqdb=1&dbnu=1,LOC PLACE,Bruxelles,plaza,0.755182,street,0.0988784,palace,0.0409997,embassy,0.0160167,courtyard,0.0158844
00031717,,,,,,,,LOC BUILDING,l' école de police,plaza,0.755182,street,0.0988784,palace,0.0409997,embassy,0.0160167,courtyard,0.0158844
00031717,,,,,,,,LOC PLACE,Bruxelles,plaza,0.755182,street,0.0988784,palace,0.0409997,embassy,0.0160167,courtyard,0.0158844
00032072,L'Oberst Hodissen (à droite) avait déjà fait preuve en Pologne de procédés très expéditifs envers la population civils. Il sera tué en 1941 sur le front de l'Est.,,,,,"Photos de Hodissen, [1940-1945]. - 1 photo",http://pallas.cegesoma.be/pls/opac/opac.search?lan=F&seop=5&sele=52&sepa=1&doty=_CA&sest=&chna=&senu=32072&rqdb=1&dbnu=1,LOC PLACE,Pologne,street,0.787261,plaza,0.106112,medina,0.0550976,ice skating rink,0.0127996,alley,0.0080788
00032072,,,,,,,,LOC MISC,le front de l' Est,street,0.787261,plaza,0.106112,medina,0.0550976,ice skating rink,0.0127996,alley,0.0080788
00032503,Inauguration du club des anciens combattants belges. Londres 30 mai 1942.,,,,,"Hubert Pierlot, homme politique belge, premier ministre, 1940-1944. - 97 photos",http://pallas.cegesoma.be/pls/opac/opac.search?lan=F&seop=5&sele=52&sepa=1&doty=_CA&sest=&chna=&senu=32503&rqdb=1&dbnu=1,LOC PLACE,Londres,street,0.657144,promenade,0.0455377,arcade,0.0415207,alley,0.0397166,cemetery,0.0232269
00032537,Hommage au Soldat Inconnu par les anciens de la Brigade Piron (probablement en 1957).,,,,,"Hubert Pierlot, homme politique belge, premier ministre, 1940-1944. - 97 photos",http://pallas.cegesoma.be/pls/opac/opac.search?lan=F&seop=5&sele=52&sepa=1&doty=_CA&sest=&chna=&senu=32537&rqdb=1&dbnu=1,LOC MONUMENT,Soldat Inconnu,plaza,0.430569,palace,0.107122,street,0.0746315,promenade,0.0729731,courtyard,0.0703553
00032569,"Fête nationale belge à Londres, 21 juillet 1943.  M. Pierlot, Premier Ministre et Ministre de la Défense Nationale passant en revue les fusilliers marins belges.",,,,,"Hubert Pierlot, homme politique belge, premier ministre, 1940-1944. - 97 photos",http://pallas.cegesoma.be/pls/opac/opac.search?lan=F&seop=5&sele=52&sepa=1&doty=_CA&sest=&chna=&senu=32569&rqdb=1&dbnu=1,LOC PLACE,Londres,street,0.350365,plaza,0.195898,crosswalk,0.0904501,bazaar,0.0732224,promenade,0.0504166
00032588,"Fête Nationale Belge, Londres, 21 juillet 19343. -- -- M. Pierlot, Premier Ministre et Ministre de la Défense Nationale passant en revue un détachement des Forces Belges en Grande-Bretagne.",,,,,"Hubert Pierlot, homme politique belge, premier ministre, 1940-1944. - 97 photos",http://pallas.cegesoma.be/pls/opac/opac.search?lan=F&seop=5&sele=52&sepa=1&doty=_CA&sest=&chna=&senu=32588&rqdb=1&dbnu=1,LOC PLACE,Belge,street,0.615152,plaza,0.163376,crosswalk,0.0751806,downtown,0.0148082,alley,0.0141197
00032588,,,,,,,,LOC PLACE,Londres,street,0.615152,plaza,0.163376,crosswalk,0.0751806,downtown,0.0148082,alley,0.0141197
00033363,Bruxelles - La police. [Graphopresse],police--bruxelles (belgique),Q31,Q239,Bruxelles,"H. Vandervorst, commandant de l'escadron mobile de la police de Bruxelles, 1940-1945. - 1 photo",http://pallas.cegesoma.be/pls/opac/opac.search?lan=F&seop=5&sele=52&sepa=1&doty=_CA&sest=&chna=&senu=33363&rqdb=1&dbnu=1,LOC PLACE,Bruxelles,plaza,0.788195,street,0.0564648,embassy,0.0473589,crosswalk,0.0404074,office building,0.012933
00033502,"Bruxelles, le 22 février 1934. Les funérailles du Roi Albert. [Sipho]",funerailles--rites et ceremonies--belgique,Q31,Q31,Belgique,"Funérailles du Roi Albert I, 22/2/1934. - 74 photos",http://pallas.cegesoma.be/pls/opac/opac.search?lan=F&seop=5&sele=52&sepa=1&doty=_CA&sest=&chna=&senu=33502&rqdb=1&dbnu=1,LOC PLACE,Bruxelles,plaza,0.472631,street,0.154594,ice skating rink,0.0879074,palace,0.0664929,courtyard,0.0539874
00033528,"Bruxelles, le 22 février 1934. Les funérailles du Roi Albert. La délégation française. [Sipho]",funerailles--rites et ceremonies--belgique,Q31,Q31,Belgique,"Funérailles du Roi Albert I, 22/2/1934. - 74 photos",http://pallas.cegesoma.be/pls/opac/opac.search?lan=F&seop=5&sele=52&sepa=1&doty=_CA&sest=&chna=&senu=33528&rqdb=1&dbnu=1,LOC PLACE,Bruxelles,plaza,0.401136,palace,0.0961421,building facade,0.0643244,courtyard,0.0357135,bullring,0.0332364
00033541,La mort du Roi Albert. La foule aux abords du Palais de Laeken. [Sipho],funerailles--rites et ceremonies--belgique,Q31,Q31,Belgique,"Funérailles du Roi Albert I, 22/2/1934. - 74 photos",http://pallas.cegesoma.be/pls/opac/opac.search?lan=F&seop=5&sele=52&sepa=1&doty=_CA&sest=&chna=&senu=33541&rqdb=1&dbnu=1,LOC BUILDING,Palais de Laeken,bazaar,0.23707,street,0.141626,crosswalk,0.117973,plaza,0.100035,slum,0.0767083
00033553,Devant le corps du Roi Albert Ier exposé au Palais Royal de Bruxelles le peuple belge défile. [France Presse - Paris],funerailles--rites et ceremonies--belgique,Q31,Q31,Belgique,"Funérailles du Roi Albert I, 22/2/1934. - 74 photos",http://pallas.cegesoma.be/pls/opac/opac.search?lan=F&seop=5&sele=52&sepa=1&doty=_CA&sest=&chna=&senu=33553&rqdb=1&dbnu=1,LOC BUILDING,Palais Royal de Bruxelles,plaza,0.288153,ice skating rink,0.263992,promenade,0.182628,ski resort,0.0392262,amphitheater,0.0288382
00033580,Bruxelles le 22 février 1934. Les funérailles du Roi Albert. [Sipho],funerailles--rites et ceremonies--belgique,Q31,Q31,Belgique,"Funérailles du Roi Albert I, 22/2/1934. - 74 photos",http://pallas.cegesoma.be/pls/opac/opac.search?lan=F&seop=5&sele=52&sepa=1&doty=_CA&sest=&chna=&senu=33580&rqdb=1&dbnu=1,LOC PLACE,Bruxelles,mosque,0.273502,temple,0.261263,palace,0.111087,plaza,0.100446,pagoda,0.0705437
00033586,"Bruxelles, le 22 février 1934. Les funérailles du Roi Albert. Le char funèbre. [Sipho]",funerailles--rites et ceremonies--belgique,Q31,Q31,Belgique,"Funérailles du Roi Albert I, 22/2/1934. - 74 photos",http://pallas.cegesoma.be/pls/opac/opac.search?lan=F&seop=5&sele=52&sepa=1&doty=_CA&sest=&chna=&senu=33586&rqdb=1&dbnu=1,LOC PLACE,Bruxelles,plaza,0.210511,palace,0.174969,embassy,0.167549,street,0.153815,campus,0.0799353
00033636,"Bruxelles, la foule défile devant le corps du Général Bernheim. [Gregor  Kutschuk] [Sipho]",funerailles--rites et ceremonies--belgique,Q31,Q31,Belgique,"Funérailles du général Bernheim, [...-1939]. - 9 photos",http://pallas.cegesoma.be/pls/opac/opac.search?lan=F&seop=5&sele=52&sepa=1&doty=_CA&sest=&chna=&senu=33636&rqdb=1&dbnu=1,LOC PLACE,Bruxelles,plaza,0.399149,medina,0.195274,train station,0.0485849,courtyard,0.0475772,beer hall,0.0355495
00033654,Le cortège funèbre fait le tour de la grand place de Bruxelles que le regretté bourgmestre aimait tant à regarder.  : 10/11/1939. [International photo press service] [Sipho],funerailles--rites et ceremonies--belgique,Q31,Q31,Belgique,"Funérailles de Adolphe Max, bourgmestre de Bruxelles, 10/11/1939. - 9 photos",http://pallas.cegesoma.be/pls/opac/opac.search?lan=F&seop=5&sele=52&sepa=1&doty=_CA&sest=&chna=&senu=33654&rqdb=1&dbnu=1,LOC STREET,la grand place de Bruxelles,street,0.898819,plaza,0.0285878,downtown,0.010525,apartment building,0.00991871,crosswalk,0.00905384
00033656,"Les funérailles de M. Adolphe Max, Bourgmestre de Bruxelles. -- -- Le Cortège Funèbre quitte la Grand'Place, le corbillard, suivi des personnalités, passe devant la Maison du Roi : 9/11/1939. [Actualit]",funerailles--rites et ceremonies--belgique,Q31,Q31,Belgique,"Funérailles de Adolphe Max, bourgmestre de Bruxelles, 10/11/1939. - 9 photos",http://pallas.cegesoma.be/pls/opac/opac.search?lan=F&seop=5&sele=52&sepa=1&doty=_CA&sest=&chna=&senu=33656&rqdb=1&dbnu=1,LOC PLACE,Bruxelles,street,0.728665,embassy,0.0879579,office building,0.034181,plaza,0.0334058,apartment building,0.0246814
00033656,,,,,,,,LOC STREET,la Grand'Place,street,0.728665,embassy,0.0879579,office building,0.034181,plaza,0.0334058,apartment building,0.0246814
00033656,,,,,,,,LOC BUILDING,la Maison du Roi,street,0.728665,embassy,0.0879579,office building,0.034181,plaza,0.0334058,apartment building,0.0246814
00033660,"Les funérailles de M. Adolphe Max, Bourgmestre de Bruxelles. Le cortège funèbre passe devant la Collégiale Ste. Gudule, on remarque la foule sur les marches de l'église : 9/11/1939. [Actualit]",funerailles--rites et ceremonies--belgique,Q31,Q31,Belgique,"Funérailles de Adolphe Max, bourgmestre de Bruxelles, 10/11/1939. - 9 photos",http://pallas.cegesoma.be/pls/opac/opac.search?lan=F&seop=5&sele=52&sepa=1&doty=_CA&sest=&chna=&senu=33660&rqdb=1&dbnu=1,LOC PLACE,Bruxelles,church,0.296322,church,0.120906,arch,0.118607,plaza,0.0942503,synagogue,0.0824833
00033660,,,,,,,,LOC BUILDING,la Collégiale Ste . Gudule,church,0.296322,church,0.120906,arch,0.118607,plaza,0.0942503,synagogue,0.0824833
00033662,"Funérailles de l'agent de Saint-Gilles, M. Tielemans, tué lâchement par un bandit. La photo montre la foule amassée le long du cortège funèbre. [Actualit]",funerailles--rites et ceremonies--belgique,Q31,Q31,Belgique,"Funérailles de l'agent de police Tielemans, [...-1939]. - 2 photos",http://pallas.cegesoma.be/pls/opac/opac.search?lan=F&seop=5&sele=52&sepa=1&doty=_CA&sest=&chna=&senu=33662&rqdb=1&dbnu=1,LOC PLACE,Saint-Gilles,plaza,0.385387,stage,0.211133,arena,0.109915,auditorium,0.062411,stage,0.0518641
00033670,"Réconcilitation devant les tombes. Un groupe d'Allemands conduits par Mr. von Mumm de la légation allemande à Bruxelles et composé des délegués des cheminots, des membres du clergé et du conseil municipal d'Aix-la-Chapelle. Des représentants des divers syndicats de mutilés de guerre, des délégations ouvrières et des journalistes, s'est rendu le jour de la Toussaint à la cathédrale d'Ypres et ensuite au pied du monument Yprois, où des choeurs ont été chantés à la mémoire des héros belges, français et anglais par la chorale ""Harmonia"" d'Aix-la-Chapelle : Nos photos représentent : 1. Monsieur Wilhelm Von Piltz, Président de l'Association des Invalides allemands prononçant un discours sur les tombes des soldats anglais. 2/ Un groupe des personnalités assistant au pélérinage. (A l'extrême-droite - Mr. Von Mumm). Cette photo a été prise devant le cimitière allemand.  3/ Ma célèbre chorale ""Harmonia"" dirigé par Mr. Aachen chantant devant le monument anglais à Ypres.   [Sipho]",cimetieres militaires--belgique,Q31,Q31,Belgique,Cimetières de guerre : [...-1939]. -  20 photos,http://pallas.cegesoma.be/pls/opac/opac.search?lan=F&seop=5&sele=52&sepa=1&doty=_CA&sest=&chna=&senu=33670&rqdb=1&dbnu=1,LOC PLACE,Bruxelles,crosswalk,0.912844,plaza,0.0275417,campus,0.0248473,amphitheater,0.0187743,promenade,0.00919467
00033670,,,,,,,,LOC PLACE,Aix-la-Chapelle,crosswalk,0.912844,plaza,0.0275417,campus,0.0248473,amphitheater,0.0187743,promenade,0.00919467
00033670,,,,,,,,LOC BUILDING,la cathédrale d' Ypres,crosswalk,0.912844,plaza,0.0275417,campus,0.0248473,amphitheater,0.0187743,promenade,0.00919467
00033670,,,,,,,,LOC MONUMENT,monument Yprois,crosswalk,0.912844,plaza,0.0275417,campus,0.0248473,amphitheater,0.0187743,promenade,0.00919467
00033670,,,,,,,,LOC PLACE,Aix-la-Chapelle,crosswalk,0.912844,plaza,0.0275417,campus,0.0248473,amphitheater,0.0187743,promenade,0.00919467
00033670,,,,,,,,LOC MONUMENT,le monument anglais,crosswalk,0.912844,plaza,0.0275417,campus,0.0248473,amphitheater,0.0187743,promenade,0.00919467
00033670,,,,,,,,LOC PLACE,Ypres,crosswalk,0.912844,plaza,0.0275417,campus,0.0248473,amphitheater,0.0187743,promenade,0.00919467
00033818,"Au 1° Régiment des Grenadiers. Ce matin a eu lieu à la caserne des Grenadiers, à Bruxelles, la remise des tambours de parade offerts par l'Association des habitants du quartier. Une jeune fille remettant un tambour à un soldat. [Actualit]","defiles--belgique, belgique--forces armees","Q31, Q31","Q31, Q31","Belgique, Belgique","Défilés de l'Armée belge, [...-1939]. - 42 photos",http://pallas.cegesoma.be/pls/opac/opac.search?lan=F&seop=5&sele=52&sepa=1&doty=_CA&sest=&chna=&senu=33818&rqdb=1&dbnu=1,LOC BUILDING,la caserne des Grenadiers,street,0.448135,plaza,0.139665,crosswalk,0.105474,playground,0.0625665,baseball field,0.0600723
00033818,,,,,,,,LOC PLACE,Bruxelles,street,0.448135,plaza,0.139665,crosswalk,0.105474,playground,0.0625665,baseball field,0.0600723
00033823,"Au 1° Régiment des Grénadiers. Ce matin a eu lieu à la caserne des Grenadiers, à Bruxelles, la remise des tambours de parade offerts par l'Association des Habitants du quartier. Une vue de la cérémonie. 28/3/36 [Actualit]","defiles--belgique, belgique--forces armees","Q31, Q31","Q31, Q31","Belgique, Belgique","Défilés de l'Armée belge, [...-1939]. - 42 photos",http://pallas.cegesoma.be/pls/opac/opac.search?lan=F&seop=5&sele=52&sepa=1&doty=_CA&sest=&chna=&senu=33823&rqdb=1&dbnu=1,LOC BUILDING,la caserne des Grenadiers,plaza,0.403753,street,0.292532,crosswalk,0.25377,racecourse,0.00908521,downtown,0.0039545
00033823,,,,,,,,LOC PLACE,Bruxelles,plaza,0.403753,street,0.292532,crosswalk,0.25377,racecourse,0.00908521,downtown,0.0039545
00033866,"A l'occasion de l'Anniversaire de la Bataille de l'Yser, le Roi Albert assiste au féfilé des anciens combattants devant le Palais Royal à Bruxelles. [Actualit]","defiles--belgique, belgique--forces armees","Q31, Q31","Q31, Q31","Belgique, Belgique","Défilés de l'Armée belge, [...-1939]. - 42 photos",http://pallas.cegesoma.be/pls/opac/opac.search?lan=F&seop=5&sele=52&sepa=1&doty=_CA&sest=&chna=&senu=33866&rqdb=1&dbnu=1,LOC WATERWAYS,l' Yser,plaza,0.875175,ice skating rink,0.0582757,campus,0.0170483,promenade,0.0136191,crosswalk,0.00906315
00033866,,,,,,,,LOC BUILDING,le Palais Royal,plaza,0.875175,ice skating rink,0.0582757,campus,0.0170483,promenade,0.0136191,crosswalk,0.00906315
00033866,,,,,,,,LOC PLACE,Bruxelles,plaza,0.875175,ice skating rink,0.0582757,campus,0.0170483,promenade,0.0136191,crosswalk,0.00906315
00034034,"L'armée, la Croix-Rouge et la Garde Civile d'Ixelles se mettent au travail. On pose avant le départ.[Sipho]",,,,,Collecte de couvertures pour les soldats : [...-1939]. -  9 photos,http://pallas.cegesoma.be/pls/opac/opac.search?lan=F&seop=5&sele=52&sepa=1&doty=_CA&sest=&chna=&senu=34034&rqdb=1&dbnu=1,LOC PLACE,Ixelles,street,0.18622,medina,0.184736,fire station,0.11901,construction site,0.0872747,alley,0.0546761
00034411,Une manifestation de pères de famille à Bruxelles. -- -- La Ligue des Familles nombreuses a organisé une manifestation imposante dans la capitale. Les membres de la ligue venus en grands nombres parcouraient les rues portant de grands calicots avec leurs revendications : 4 novembre 1934. [Actualit],"manifestations--bruxelles (belgique), ligue des grandes familles--bruxelles (belgique)","Q31, Q31","Q239, Q239","Bruxelles, Bruxelles","Manifestation de la Ligue des Familles nombreuses à Bruxelles, 4/11/1934. - 1 photo",http://pallas.cegesoma.be/pls/opac/opac.search?lan=F&seop=5&sele=52&sepa=1&doty=_CA&sest=&chna=&senu=34411&rqdb=1&dbnu=1,LOC PLACE,Bruxelles,train station,0.499275,street,0.35669,medina,0.0712532,railroad track,0.020399,subway station,0.0119634
00034417,"Les protecteurs des animaux protestent. Une manifestation grandiose, organisée par la Société Protectrice des Animaux, s'est déroulée ce dimanche à Bruxelles. Elle a été organisée en signe de protestation contre les tirs aux pigeons et la vivisection. Le cortège. 16/10/32 [Sipho]",manifestations--belgique,Q31,Q31,Belgique,Manifestation des protecteurs des animaux : 16/10/1932. -  2 photos,http://pallas.cegesoma.be/pls/opac/opac.search?lan=F&seop=5&sele=52&sepa=1&doty=_CA&sest=&chna=&senu=34417&rqdb=1&dbnu=1,LOC PLACE,Bruxelles,street,0.624811,crosswalk,0.18303,plaza,0.0823612,ticket booth,0.0176466,downtown,0.00998115
00034423,"La manifestation nationale des commerçants. Environ 10.000 personnes, venues de toutes les provinces du pays ont manifesté aujourd'hui (le 24.XI) à Bruxelles contre la prohibition et les taxes sur les bières. Le cortège. [Sipho]",manifestations--bruxelles (belgique),Q31,Q239,Bruxelles,"Manifestation de commerçants de boissons alcoolisées à Bruxelles, [...-1939]. - 2 photos",http://pallas.cegesoma.be/pls/opac/opac.search?lan=F&seop=5&sele=52&sepa=1&doty=_CA&sest=&chna=&senu=34423&rqdb=1&dbnu=1,LOC PLACE,Bruxelles,plaza,0.552904,street,0.106053,bazaar,0.098701,downtown,0.0670062,crosswalk,0.0462558
00034523,"Une grande manifestation d'enfants, contre l'alcool a eu lieu ce jour (le 21/1/1932) à Bruxelles. Une vue d'ensemble de la manifestation. [Gregor Kutschuk] [Sipho]","manifestations--bruxelles (belgique), enfants--bruxelles (belgique)","Q31, Q31","Q239, Q239","Bruxelles, Bruxelles","Manifestation d'enfants contre l'alcool à Bruxelles, 21/1/1932. - 2 photos",http://pallas.cegesoma.be/pls/opac/opac.search?lan=F&seop=5&sele=52&sepa=1&doty=_CA&sest=&chna=&senu=34523&rqdb=1&dbnu=1,LOC PLACE,Bruxelles,street,0.345896,plaza,0.321972,promenade,0.141507,apartment building,0.0508008,downtown,0.0311364
00034529,"La marche de la faim sur Bruxelles organisée par les communistes a échoué jusqu'ici. Notre photo montre des cyclistes fouillés par la police à la place de la Bourse, à Bruxelles : 30 mars 1933. [Actualit]",manifestations--bruxelles (belgique),Q31,Q239,Bruxelles,"Marche de la faim à Bruxelles, 30/3/1933. - 1 photo",http://pallas.cegesoma.be/pls/opac/opac.search?lan=F&seop=5&sele=52&sepa=1&doty=_CA&sest=&chna=&senu=34529&rqdb=1&dbnu=1,LOC PLACE,Bruxelles,crosswalk,0.720053,street,0.102579,plaza,0.0696123,amphitheater,0.0119717,promenade,0.0100776
00034529,,,,,,,,LOC BUILDING,la Bourse,crosswalk,0.720053,street,0.102579,plaza,0.0696123,amphitheater,0.0119717,promenade,0.0100776
00034529,,,,,,,,LOC PLACE,Bruxelles,crosswalk,0.720053,street,0.102579,plaza,0.0696123,amphitheater,0.0119717,promenade,0.0100776
00034547,Manifestation contre l'amnistie. Les Anciens combattants ont défilé dans les rues de Bruxelles et ont voulu envahir le parlement. -- -- La photo les montre arrêtes par d'importants barrages de gendarmes.  23 juin 1937 [Actualit],"manifestations--bruxelles (belgique), anciens combattants--bruxelles (belgique)","Q31, Q31","Q239, Q239","Bruxelles, Bruxelles","Manifestation d'anciens combattants à Bruxelles, 1937. - 21 photos",http://pallas.cegesoma.be/pls/opac/opac.search?lan=F&seop=5&sele=52&sepa=1&doty=_CA&sest=&chna=&senu=34547&rqdb=1&dbnu=1,LOC PLACE,Bruxelles,plaza,0.884242,crosswalk,0.042728,bazaar,0.0243664,street,0.00574835,downtown,0.00570344
00034556,Manifestation contre l'amnistie. Une grille du Parc Royal renversée par les manifestants.  23/6/37 [Actualit],"manifestations--bruxelles (belgique), anciens combattants--bruxelles (belgique)","Q31, Q31","Q239, Q239","Bruxelles, Bruxelles","Manifestation d'anciens combattants à Bruxelles, 1937. - 21 photos",http://pallas.cegesoma.be/pls/opac/opac.search?lan=F&seop=5&sele=52&sepa=1&doty=_CA&sest=&chna=&senu=34556&rqdb=1&dbnu=1,LOC SPACES,Parc Royal,crosswalk,0.397419,promenade,0.237479,street,0.192731,train station,0.0449611,subway station,0.0231398
00034558,"Manifestation contre l'amnistie. Les Anciens combattants se sont rendus en pélerinage à la Place des Martyrs de 1830 à Bruxelles, ils ont enroulé leurs drapeaux dans des crêpes en signe de deuil et ne les dérouleront à nouveau que lorsqu'ils auront obtenu satisfaction. Les Anciens Combattants massés autour du Monuments aux Martyrs de la Révolution de 1830. 8/7/37 [Actualit]","manifestations--bruxelles (belgique), anciens combattants--bruxelles (belgique)","Q31, Q31","Q239, Q239","Bruxelles, Bruxelles","Manifestation d'anciens combattants à Bruxelles, 1937. - 21 photos",http://pallas.cegesoma.be/pls/opac/opac.search?lan=F&seop=5&sele=52&sepa=1&doty=_CA&sest=&chna=&senu=34558&rqdb=1&dbnu=1,LOC SPACES,la Place des Martyrs de 1830,palace,0.531666,embassy,0.353563,plaza,0.0392692,apartment building,0.0186087,building facade,0.0143091
00034558,,,,,,,,LOC PLACE,Bruxelles,palace,0.531666,embassy,0.353563,plaza,0.0392692,apartment building,0.0186087,building facade,0.0143091
00034558,,,,,,,,LOC MONUMENT,Monuments aux Martyrs de la Révolution de 1830,palace,0.531666,embassy,0.353563,plaza,0.0392692,apartment building,0.0186087,building facade,0.0143091
00034560,D'anciens combattants amputés et mutilés Belges protestent à Bruxelles... contre le Gouvernement. Après s'être assis au milieu des boulevards du centre de la ville; ils interrompirent la circulation et la police eut beaucoup de mal pour les déloger : 6/4/1936. [Wide World Photos - NYT],"manifestations--bruxelles (belgique), anciens combattants--bruxelles (belgique)","Q31, Q31","Q239, Q239","Bruxelles, Bruxelles","Manifestation d'anciens combattants à Bruxelles, 1937. - 21 photos",http://pallas.cegesoma.be/pls/opac/opac.search?lan=F&seop=5&sele=52&sepa=1&doty=_CA&sest=&chna=&senu=34560&rqdb=1&dbnu=1,LOC PLACE,Bruxelles,bazaar,0.586371,street,0.230135,medina,0.123732,plaza,0.0121697,slum,0.00989163
00034589,Manifestation flamande pour l'Amnistie à Bruxelles. Le passage de la manifestation au boulevard Botanique : 23/5/37. [Actualit],"manifestations--antwerpen (belgique), amnistie--antwerpen (belgique)","Q31, Q31","Q12892, Q12892","Anvers, Anvers","Manifestation pour l'amnistie à Antwerpen, 23/5/1937. - 3 photos",http://pallas.cegesoma.be/pls/opac/opac.search?lan=F&seop=5&sele=52&sepa=1&doty=_CA&sest=&chna=&senu=34589&rqdb=1&dbnu=1,LOC PLACE,Bruxelles,plaza,0.318805,ice skating rink,0.280748,apartment building,0.0849736,palace,0.0630659,building facade,0.0519005
00034589,,,,,,,,LOC STREET,boulevard Botanique,plaza,0.318805,ice skating rink,0.280748,apartment building,0.0849736,palace,0.0630659,building facade,0.0519005
00034687,Une manifestation des sans-filistes à Bruxelles. Pour protester contre la fermeture par le gouvernement belge d'un poste privé de T.S.F. tous les sans-filistes de Belgique ont organisé une manifestation monstre. -- -- Le cortège parcourant les rues de Bruxelles. [Sipho],"manifestations--bruxelles (belgique), radio--bruxelles (belgique)","Q31, Q31","Q239, Q239","Bruxelles, Bruxelles","Manifestations de radio-amateurs à Bruxelles, [...-1939]. - 3 photos",http://pallas.cegesoma.be/pls/opac/opac.search?lan=F&seop=5&sele=52&sepa=1&doty=_CA&sest=&chna=&senu=34687&rqdb=1&dbnu=1,LOC PLACE,Bruxelles,street,0.24676,plaza,0.245748,downtown,0.0628437,office building,0.0610026,building facade,0.0322015
00034687,,,,,,,,LOC PLACE,Belgique,street,0.24676,plaza,0.245748,downtown,0.0628437,office building,0.0610026,building facade,0.0322015
00034687,,,,,,,,LOC PLACE,Bruxelles,street,0.24676,plaza,0.245748,downtown,0.0628437,office building,0.0610026,building facade,0.0322015
00034689,"Une manifestation des sans-filistes à Bruxelles. Pour protester contre la fermeture d'un poste privé de T.S.F. par le gouvernement belge, tous les sans-filistes de Belgique ont organisé une manifestation monstre qui s'est déroulée aujourd'hui à Bruxelles. -- -- Le cortège parcourant les rues. [Sipho]","manifestations--bruxelles (belgique), radio--bruxelles (belgique)","Q31, Q31","Q239, Q239","Bruxelles, Bruxelles","Manifestations de radio-amateurs à Bruxelles, [...-1939]. - 3 photos",http://pallas.cegesoma.be/pls/opac/opac.search?lan=F&seop=5&sele=52&sepa=1&doty=_CA&sest=&chna=&senu=34689&rqdb=1&dbnu=1,LOC PLACE,Bruxelles,plaza,0.38149,street,0.363783,promenade,0.0430779,apartment building,0.0324079,palace,0.025478
00034689,,,,,,,,LOC PLACE,Belgique,plaza,0.38149,street,0.363783,promenade,0.0430779,apartment building,0.0324079,palace,0.025478
00034689,,,,,,,,LOC PLACE,Bruxelles,plaza,0.38149,street,0.363783,promenade,0.0430779,apartment building,0.0324079,palace,0.025478
00034691,"Une manifestation des sans-filistes à Bruxelles. Pour protester contre la fermeture d'un poste privé de T.S.F. par le gouvernement belge, tous les sans-filistes de Belgique ont organisé une manifestation monstre. -- -- La foule massée à la Grand-Place de Bruxelles écoute les orateurs. [Photopers bureau Holland] [Sipho]","manifestations--bruxelles (belgique), radio--bruxelles (belgique)","Q31, Q31","Q239, Q239","Bruxelles, Bruxelles","Manifestations de radio-amateurs à Bruxelles, [...-1939]. - 3 photos",http://pallas.cegesoma.be/pls/opac/opac.search?lan=F&seop=5&sele=52&sepa=1&doty=_CA&sest=&chna=&senu=34691&rqdb=1&dbnu=1,LOC PLACE,Bruxelles,plaza,0.621786,palace,0.0664773,building facade,0.0593348,church,0.0566609,courtyard,0.0194864
00034691,,,,,,,,LOC PLACE,Belgique,plaza,0.621786,palace,0.0664773,building facade,0.0593348,church,0.0566609,courtyard,0.0194864
00034691,,,,,,,,LOC STREET,la Grand-Place de Bruxelles,plaza,0.621786,palace,0.0664773,building facade,0.0593348,church,0.0566609,courtyard,0.0194864
